<?xml version="1.0" encoding="UTF-8"?>
<xs:schema xmlns:xs="http://www.w3.org/2001/XMLSchema">

    <!-- Define the structure of the <team> element -->
    <xs:element name="team">
        <xs:complexType>
            <xs:sequence>
                <!-- Define the <member> element, which can appear multiple times -->
                <xs:element name="member" maxOccurs="unbounded">
                    <xs:complexType>
                        <xs:sequence>
                            <xs:element name="name" type="xs:string"/>
                            <xs:element name="role" type="xs:string"/>
                            <xs:element name="image" type="xs:string"/>
                            <xs:element name="description" type="xs:string"/>
                        </xs:sequence>
                    </xs:complexType>
                </xs:element>
            </xs:sequence>
        </xs:complexType>
    </xs:element>

</xs:schema>